{
  "format": "construct-params",
  "version": 1,
  "archetype": "object",
  "variant": "acoustic-guitar",
  "id": "object-acoustic-guitar",
  "title": "Exemplar D-Example (acoustic guitar)",
  "synthetic": true,
  "sources": [
    {
      "id": "request",
      "kind": "user_request",
      "title": "Synthetic example request",
      "rights": "synthetic"
    }
  ],
  "facts": [
    {
      "key": "maker",
      "value": "Exemplar",
      "certainty": "user_supplied",
      "source": "request",
      "note": "invented for this synthetic example"
    },
    {
      "key": "model",
      "value": "D-Example",
      "certainty": "user_supplied",
      "source": "request",
      "note": "invented for this synthetic example"
    }
  ]
}
