{
  "format": "construct-params",
  "version": 1,
  "archetype": "book",
  "variant": "hardcover",
  "id": "book-hardcover",
  "title": "An Example Novel (hardcover)",
  "synthetic": true,
  "sources": [
    {
      "id": "request",
      "kind": "user_request",
      "title": "Synthetic example request",
      "rights": "synthetic"
    },
    {
      "id": "generated-art",
      "kind": "generated",
      "title": "Abstract pattern generated by the toolkit (png.py)",
      "rights": "synthetic"
    }
  ],
  "facts": [
    {
      "key": "title",
      "value": "An Example Novel",
      "certainty": "user_supplied",
      "source": "request",
      "note": "invented for this synthetic example"
    },
    {
      "key": "author",
      "value": "A. N. Author",
      "certainty": "user_supplied",
      "source": "request",
      "note": "invented for this synthetic example"
    }
  ],
  "assets": [
    {
      "id": "book-art",
      "path": "assets/book-cover.png",
      "sha256": "2eaff397f5ab6161e65841cdadbf7386e85949273172a543a7e7f51e7f875032",
      "media_type": "image/png",
      "rights": "synthetic",
      "provenance": "generated-decorative",
      "source": "generated-art"
    }
  ],
  "artwork": {
    "cover-front": "book-art"
  }
}
