{
  "format": "construct-params",
  "version": 1,
  "archetype": "object",
  "variant": "synth",
  "id": "object-synth",
  "title": "Exemplar SYN-49 (synthesizer)",
  "synthetic": true,
  "sources": [
    {
      "id": "request",
      "kind": "user_request",
      "title": "Synthetic example request",
      "rights": "synthetic"
    }
  ],
  "facts": [
    {
      "key": "maker",
      "value": "Exemplar",
      "certainty": "user_supplied",
      "source": "request",
      "note": "invented for this synthetic example"
    },
    {
      "key": "model",
      "value": "SYN-49",
      "certainty": "user_supplied",
      "source": "request",
      "note": "invented for this synthetic example"
    }
  ]
}
